{
  "authoritative_record_count": 12,
  "blocked_reasons": [],
  "generated_at_utc": "2026-08-16T11:55:04Z",
  "invalid_record_count": 0,
  "legacy_record_count": 23,
  "manifest_status": "pass_with_legacy_migration_blockers",
  "mode": "BOUNDED_AUTONOMOUS",
  "path_source": "git_tracked",
  "production_safety_classification": "PROD_SAFE_OFFLINE_STATIC_ONLY",
  "record_count": 35,
  "records": [
    {
      "artifacts": [
        {
          "evidence_status": "unknown",
          "kind": "public_safe_report_summary",
          "reference": "docs/qa/reports/task020_full_invalid_phone_negative.summary.json",
          "sha256": "890e7ca0fd8211831b659d8b77f5f2238b3f2ef14a33e7aeceeb0da76920ee5a"
        }
      ],
      "authoritative": false,
      "authority_status": "legacy_not_authoritative",
      "blocked_reasons": [
        "legacy_report_not_evidence_envelope_v2"
      ],
      "build_ref": {
        "alias": "unknown_build"
      },
      "coverage_status": "unknown",
      "evidence_status": "unknown",
      "execution_status": "unknown",
      "generated_at_utc": "unknown",
      "production_safety_classification": "unknown",
      "provenance": {
        "indexed_by_task": "TASK-038",
        "source_kind": "tracked_public_safe_report",
        "source_reference": "docs/qa/reports/task020_full_invalid_phone_negative.summary.json",
        "source_sha256": "890e7ca0fd8211831b659d8b77f5f2238b3f2ef14a33e7aeceeb0da76920ee5a"
      },
      "record_id": "TASK-020__unknown_build__unknown_target__task020_full_invalid_phone_negative.summary__task020_full_invalid_phone_negative.summary",
      "release_effect": "no_release_claim",
      "review": {
        "manifest_generator": "generated",
        "schema_policy": "legacy_migration_blocked"
      },
      "risks": [
        {
          "id": "RISK-065",
          "level": "High",
          "status": "active",
          "summary": "Legacy or unknown report schema cannot be used as authoritative release evidence."
        }
      ],
      "run_id": "task020_full_invalid_phone_negative.summary",
      "schema_validation_status": "legacy_migration_blocked",
      "schema_version": "task020_full_invalid_phone_negative_summary_v1",
      "superseded_by": null,
      "supersedes": [],
      "target_alias": "unknown_target",
      "task_id": "TASK-020",
      "unknowns": [
        {
          "evidence_status": "unknown",
          "id": "U-T038-MIGRATION",
          "question": "Report is not yet migrated to evidence-report-envelope-v2."
        },
        {
          "evidence_status": "unknown",
          "id": "U-T038-MISSING-GENERATED_AT_UTC",
          "question": "Legacy report has no top-level generated_at_utc."
        },
        {
          "evidence_status": "unknown",
          "id": "U-T038-MISSING-EVIDENCE_STATUS",
          "question": "Legacy report has no top-level evidence_status."
        },
        {
          "evidence_status": "unknown",
          "id": "U-T038-MISSING-PRODUCTION_SAFETY_CLASSIFICATION",
          "question": "Legacy report has no top-level production_safety_classification."
        }
      ],
      "verification": [
        {
          "evidence_status": "confirmed",
          "name": "report_file_sha256",
          "reference": "docs/qa/reports/task020_full_invalid_phone_negative.summary.json",
          "sha256": "890e7ca0fd8211831b659d8b77f5f2238b3f2ef14a33e7aeceeb0da76920ee5a",
          "status": "pass"
        }
      ]
    },
    {
      "artifacts": [
        {
          "evidence_status": "confirmed",
          "kind": "public_safe_report_summary",
          "reference": "docs/qa/reports/task020_full_screen_inventory.summary.json",
          "sha256": "133d895649f07ca0a26d7322665eaba4414c4f9b26af9e4e711364c9ef75ea3d"
        }
      ],
      "authoritative": false,
      "authority_status": "legacy_not_authoritative",
      "blocked_reasons": [
        "legacy_report_not_evidence_envelope_v2"
      ],
      "build_ref": {
        "alias": "unknown_build"
      },
      "coverage_status": "unknown",
      "evidence_status": "confirmed",
      "execution_status": "unknown",
      "generated_at_utc": "unknown",
      "production_safety_classification": "unknown",
      "provenance": {
        "indexed_by_task": "TASK-038",
        "source_kind": "tracked_public_safe_report",
        "source_reference": "docs/qa/reports/task020_full_screen_inventory.summary.json",
        "source_sha256": "133d895649f07ca0a26d7322665eaba4414c4f9b26af9e4e711364c9ef75ea3d"
      },
      "record_id": "TASK-020__unknown_build__unknown_target__task020_full_screen_inventory.summary__task020_full_screen_inventory.summary",
      "release_effect": "no_release_claim",
      "review": {
        "manifest_generator": "generated",
        "schema_policy": "legacy_migration_blocked"
      },
      "risks": [
        {
          "id": "RISK-065",
          "level": "High",
          "status": "active",
          "summary": "Legacy or unknown report schema cannot be used as authoritative release evidence."
        }
      ],
      "run_id": "task020_full_screen_inventory.summary",
      "schema_validation_status": "legacy_migration_blocked",
      "schema_version": "task020_full_screen_inventory_summary_v1",
      "superseded_by": null,
      "supersedes": [],
      "target_alias": "unknown_target",
      "task_id": "TASK-020",
      "unknowns": [
        {
          "evidence_status": "unknown",
          "id": "U-T038-MIGRATION",
          "question": "Report is not yet migrated to evidence-report-envelope-v2."
        },
        {
          "evidence_status": "unknown",
          "id": "U-T038-MISSING-GENERATED_AT_UTC",
          "question": "Legacy report has no top-level generated_at_utc."
        },
        {
          "evidence_status": "unknown",
          "id": "U-T038-MISSING-PRODUCTION_SAFETY_CLASSIFICATION",
          "question": "Legacy report has no top-level production_safety_classification."
        }
      ],
      "verification": [
        {
          "evidence_status": "confirmed",
          "name": "report_file_sha256",
          "reference": "docs/qa/reports/task020_full_screen_inventory.summary.json",
          "sha256": "133d895649f07ca0a26d7322665eaba4414c4f9b26af9e4e711364c9ef75ea3d",
          "status": "pass"
        }
      ]
    },
    {
      "artifacts": [
        {
          "evidence_status": "unknown",
          "kind": "public_safe_report_summary",
          "reference": "docs/qa/reports/task020_invalid_phone_negative.summary.json",
          "sha256": "8096ad7be0774a614b79f24b325f0296d493cda97279608e2f6847a1299cc22f"
        }
      ],
      "authoritative": false,
      "authority_status": "legacy_not_authoritative",
      "blocked_reasons": [
        "legacy_report_not_evidence_envelope_v2"
      ],
      "build_ref": {
        "alias": "unknown_build"
      },
      "coverage_status": "unknown",
      "evidence_status": "unknown",
      "execution_status": "unknown",
      "generated_at_utc": "unknown",
      "production_safety_classification": "unknown",
      "provenance": {
        "indexed_by_task": "TASK-038",
        "source_kind": "tracked_public_safe_report",
        "source_reference": "docs/qa/reports/task020_invalid_phone_negative.summary.json",
        "source_sha256": "8096ad7be0774a614b79f24b325f0296d493cda97279608e2f6847a1299cc22f"
      },
      "record_id": "TASK-020__unknown_build__unknown_target__task020_invalid_phone_negative.summary__task020_invalid_phone_negative.summary",
      "release_effect": "no_release_claim",
      "review": {
        "manifest_generator": "generated",
        "schema_policy": "legacy_migration_blocked"
      },
      "risks": [
        {
          "id": "RISK-065",
          "level": "High",
          "status": "active",
          "summary": "Legacy or unknown report schema cannot be used as authoritative release evidence."
        }
      ],
      "run_id": "task020_invalid_phone_negative.summary",
      "schema_validation_status": "legacy_migration_blocked",
      "schema_version": "task020_invalid_phone_negative_summary_v1",
      "superseded_by": null,
      "supersedes": [],
      "target_alias": "unknown_target",
      "task_id": "TASK-020",
      "unknowns": [
        {
          "evidence_status": "unknown",
          "id": "U-T038-MIGRATION",
          "question": "Report is not yet migrated to evidence-report-envelope-v2."
        },
        {
          "evidence_status": "unknown",
          "id": "U-T038-MISSING-GENERATED_AT_UTC",
          "question": "Legacy report has no top-level generated_at_utc."
        },
        {
          "evidence_status": "unknown",
          "id": "U-T038-MISSING-EVIDENCE_STATUS",
          "question": "Legacy report has no top-level evidence_status."
        },
        {
          "evidence_status": "unknown",
          "id": "U-T038-MISSING-PRODUCTION_SAFETY_CLASSIFICATION",
          "question": "Legacy report has no top-level production_safety_classification."
        }
      ],
      "verification": [
        {
          "evidence_status": "confirmed",
          "name": "report_file_sha256",
          "reference": "docs/qa/reports/task020_invalid_phone_negative.summary.json",
          "sha256": "8096ad7be0774a614b79f24b325f0296d493cda97279608e2f6847a1299cc22f",
          "status": "pass"
        }
      ]
    },
    {
      "artifacts": [
        {
          "evidence_status": "confirmed",
          "kind": "public_safe_report_summary",
          "reference": "docs/qa/reports/task020_post_auth_navigation_transition.summary.json",
          "sha256": "cf856a123ead0b40ff64bc8f7e8bd4de51d4971b7295eae8b7bc3cacef4be62b"
        }
      ],
      "authoritative": false,
      "authority_status": "legacy_not_authoritative",
      "blocked_reasons": [
        "legacy_report_not_evidence_envelope_v2"
      ],
      "build_ref": {
        "alias": "unknown_build"
      },
      "coverage_status": "unknown",